<?xml version="1.0" encoding="UTF-8"?>

<actions-mapping xmlns="http://action.core.maf.j2ee5.seda.com"
	xmlns:xsi="http://www.w3.org/2001/XMLSchema-instance"
	xsi:schemaLocation="http://action.core.maf.j2ee5.seda.com ../../../WEB-INF/xsd/maf-actions.xsd">
	
		<global-ruleset>
 		<regexset>
 			<regex name="descrizione_regex">
 				<pattern>^[a-zA-Z]+(([\'\,\.\- ][a-zA-Z ])?[a-zA-Z]*)*{1,256}$</pattern>
 				<description></description>
 			</regex> 
 			<regex name="codice3char_regex">
 				<pattern>^\w{1,3}$</pattern>
 				<description></description>
 			</regex>
 			<regex name="date_yyyy_mm_dd_regex">
 				<pattern>^(19|20)\d\d([-])(0[1-9]|1[012])([-])(0[1-9]|[12][0-9]|3[01])$</pattern>
 				<description></description>
 			</regex>
 			<regex name="codice20char_regex">
 				<pattern>^\w{1,20}$</pattern>
 				<description></description>
 			</regex>
 			<regex name="codicefisc_regex">
 				<pattern>^[a-zA-Z]+(([\'\,\.\- ][a-zA-Z ])?[a-zA-Z]*)*{1,16}$</pattern>
 				<description></description>
 			</regex>
 			
 		</regexset>
 	</global-ruleset>
			
    	<!-- MERCATI MONITORAGGIO -->
    <action url="monitoraggiomercati" screen="monitoraggioMercati.screen" flow="true">
		<role-collection>
			<role>AMMI</role>
			<role>AMSO</role>
			<role>AMUT</role>
			<role>AMEN</role>
		</role-collection>
        <action-class>org.seda.payer.manager.mercatimonitoraggio.actions.MonitoraggioMercatiAction</action-class>
        <flow class="org.seda.payer.manager.mercatimonitoraggio.actions.MonitoraggioMercatiFlow">
           	<result value="Search" screen="monitoraggioMercati.screen" />
        	<result value="download" writer="fileCsv" content-type="plain/txt" inScope="true" attach="filename"/>
			 
        </flow>
         <ruleset>
        	<rule name="pageNumber" regex="num8_regex">
        		<missing severity="continue"/>
        		<malformed severity="continue"><rule-action class="com.seda.j2ee5.maf.defender.action.impl.Blank"/></malformed>
        	</rule>
        	<rule name="rowsPerPage" regex="num3_regex">
        		<missing severity="continue"/>
        		<malformed severity="continue"><rule-action class="com.seda.j2ee5.maf.defender.action.impl.Blank"/></malformed>
        	</rule>
        	
        	<rule name="tx_societa" regex="codice5obblchar_regex">
        		<missing severity="continue"/>
        		<malformed severity="continue"><rule-action class="com.seda.j2ee5.maf.defender.action.impl.Blank"/></malformed>
        	</rule>
			<rule name="tx_utente" regex="codice5obblchar_regex">
        		<missing severity="continue"/>
        		<malformed severity="continue"><rule-action class="com.seda.j2ee5.maf.defender.action.impl.Blank"/></malformed>
        	</rule>
			<rule name="tx_provincia" regex="codice2obblchar_regex"> 
        		<missing severity="continue"/>
        		<malformed severity="continue"><rule-action class="com.seda.j2ee5.maf.defender.action.impl.Blank"/></malformed>
        	</rule>
			<rule name="tx_ente" regex="codice10obblchar_regex">
        		<missing severity="continue"/>
        		<malformed severity="continue"><rule-action class="com.seda.j2ee5.maf.defender.action.impl.Blank"/></malformed>
        	</rule>
			
        </ruleset> 			
    </action>
    
       	<!-- MERCATI MONITORAGGIO -->
   
    
   
   
    <action url="mercatimanager.do" screen="mercatimanager.screen" flow="true">
		<role-collection>
			<role>AMMI</role>
			<role>AMSO</role>
			<role>AMUT</role>
			<role>AMEN</role>
		</role-collection>
        <action-class>org.seda.payer.manager.mercatomanager.actions.MercatiManager</action-class>
        <flow class="org.seda.payer.manager.flows.DispatchFlowEC">
			<result value="init" screen="mercatimanager.screen"/>
			<result value="avantiMercati" redirect="urlRedirectWallet"/>
		</flow>
	</action>

	<action url="backmanager.do" screen="mercatimanager.screen" flow="true">
		<role-collection>
			<role>AMMI</role>
			<role>AMSO</role>
			<role>AMUT</role>
			<role>AMEN</role>
		</role-collection>
        <action-class>org.seda.payer.manager.mercatomanager.actions.MercatiManager</action-class>
        <flow class="org.seda.payer.manager.flows.DispatchFlowEC">
			<result value="init" screen="mercatimanager.screen"/>
		</flow>
	</action>
    
    
	<action url="ritorna.do" flow="true">
		<role-collection>
			<role>AMMI</role>
			<role>AMSO</role>
			<role>AMUT</role>
			<role>AMEN</role>
	    </role-collection>
		<description>Action per la gestione del ritorno ad altro screen con viewstate</description>
        <action-class>org.seda.payer.manager.mercatimonitoraggio.actions.RitornaAction</action-class>
        <flow class="org.seda.payer.manager.mercatimonitoraggio.actions.RitornaFlowAction">
           	<result value="monitoraggiomercati" screen="monitoraggiomercati.do" />           	
        </flow>
    </action> 
    
    
</actions-mapping>   