<?xml version="1.0" encoding="UTF-8"?>

<actions-mapping xmlns="http://action.core.maf.j2ee5.seda.com"
	xmlns:xsi="http://www.w3.org/2001/XMLSchema-instance"
	xsi:schemaLocation="http://action.core.maf.j2ee5.seda.com ../../../WEB-INF/xsd/maf-actions.xsd">
	 
	<global-ruleset>
 		<regexset>
 			<regex name="test">
 				<pattern>^[a-zA-Z0-9]{8,20}$</pattern>
 				<description></description>
 			</regex>
 		</regexset>
 	</global-ruleset>
 	
 	<action  url="analysis.do" screen="analysis.screen" csrf="false" >
       <action-class>org.seda.payer.manager.analysis.actions.AnalysisAction</action-class>
    </action>
     	
</actions-mapping>   