<?xml version="1.0" encoding="UTF-8"?>

<actions-mapping xmlns="http://action.core.maf.j2ee5.seda.com"
	xmlns:xsi="http://www.w3.org/2001/XMLSchema-instance"
	xsi:schemaLocation="http://action.core.maf.j2ee5.seda.com ../../../WEB-INF/xsd/maf-actions.xsd">
	
		<global-ruleset>
 		<regexset>
 			<regex name="descrizione_regex">
 				<pattern>^[a-zA-Z]+(([\'\,\.\- ][a-zA-Z ])?[a-zA-Z]*)*{1,256}$</pattern>
 				<description></description>
 			</regex>
 			<regex name="codice3char_regex">
 				<pattern>^\w{1,3}$</pattern>
 				<description></description>
 			</regex>
 			<regex name="date_yyyy_mm_dd_regex">
 				<pattern>^(19|20)\d\d([-])(0[1-9]|1[012])([-])(0[1-9]|[12][0-9]|3[01])$</pattern>
 				<description></description>
 			</regex>
 			<regex name="codice20char_regex">
 				<pattern>^\w{1,20}$</pattern>
 				<description></description>
 			</regex>
 			<regex name="codicefisc_regex">
 				<pattern>^[a-zA-Z]+(([\'\,\.\- ][a-zA-Z ])?[a-zA-Z]*)*{1,16}$</pattern>
 				<description></description>
 			</regex>
 			
 		</regexset>
 	</global-ruleset>
			
    <action url="modello3.do" screen="modello3.screen" flow="true">
		<role-collection>
			<role>AMMI</role>
			<role>AMSO</role>
			<role>AMUT</role>
			<role>AMEN</role>
		</role-collection>
        <action-class>org.seda.payer.manager.modello3config.actions.Modello3Action</action-class>
        <flow class="org.seda.payer.manager.modello3config.flows.Modello3FlowAction">
           	<result value="Search" screen="modello3.screen" />
           	<result value="DownloadCsv" screen="modello3Csv.do" />
           	<result value="add" screen="modello3Edit.do?codop=add" />
        </flow>
         <ruleset>
        	<rule name="pageNumber" regex="num8_regex">
        		<missing severity="continue"/>
        		<malformed severity="continue"><rule-action class="com.seda.j2ee5.maf.defender.action.impl.Blank"/></malformed>
        	</rule>
        	<rule name="rowsPerPage" regex="num3_regex">
        		<missing severity="continue"/>
        		<malformed severity="continue"><rule-action class="com.seda.j2ee5.maf.defender.action.impl.Blank"/></malformed>
        	</rule>
        	
        	<rule name="tx_societa" regex="codice5obblchar_regex">
        		<missing severity="continue"/>
        		<malformed severity="continue"><rule-action class="com.seda.j2ee5.maf.defender.action.impl.Blank"/></malformed>
        	</rule>
			<rule name="tx_utente" regex="codice5obblchar_regex">
        		<missing severity="continue"/>
        		<malformed severity="continue"><rule-action class="com.seda.j2ee5.maf.defender.action.impl.Blank"/></malformed>
        	</rule>
			<rule name="tx_provincia" regex="codice2obblchar_regex"> 
        		<missing severity="continue"/>
        		<malformed severity="continue"><rule-action class="com.seda.j2ee5.maf.defender.action.impl.Blank"/></malformed>
        	</rule>
			<rule name="tx_ente" regex="codice10obblchar_regex">
        		<missing severity="continue"/>
        		<malformed severity="continue"><rule-action class="com.seda.j2ee5.maf.defender.action.impl.Blank"/></malformed>
        	</rule>
			
        </ruleset> 			
    </action>
    <action url="modello3Edit.do" screen="modello3Edit.screen" flow="true">
		<role-collection>
			<role>AMMI</role>
			<role>AMSO</role>
			<role>AMUT</role>
			<role>AMEN</role>
		</role-collection>
        <action-class>org.seda.payer.manager.modello3config.actions.Modello3EditAction</action-class>
        <flow class="org.seda.payer.manager.modello3config.flows.Modello3EditFlowAction">
           	<result value="Search" screen="modello3Edit.screen" />
           	<result value="edit" screen="modello3.do" />
           	<result value="DownloadCsv" screen="downloadListaCsv.do" />
           	<result value="cancella" screen="modello3Cancel.screen" />
           	<result value="ritorna" screen="ritorna.do" />
        </flow>
         <ruleset>
        	<rule name="pageNumber" regex="num8_regex">
        		<missing severity="continue"/>
        		<malformed severity="continue"><rule-action class="com.seda.j2ee5.maf.defender.action.impl.Blank"/></malformed>
        	</rule>
        	<rule name="rowsPerPage" regex="num3_regex">
        		<missing severity="continue"/>
        		<malformed severity="continue"><rule-action class="com.seda.j2ee5.maf.defender.action.impl.Blank"/></malformed>
        	</rule>
        	
        	<rule name="tx_societa" regex="codice5obblchar_regex">
        		<missing severity="continue"/>
        		<malformed severity="continue"><rule-action class="com.seda.j2ee5.maf.defender.action.impl.Blank"/></malformed>
        	</rule>
			<rule name="tx_utente" regex="codice5obblchar_regex">
        		<missing severity="continue"/>
        		<malformed severity="continue"><rule-action class="com.seda.j2ee5.maf.defender.action.impl.Blank"/></malformed>
        	</rule>
			<rule name="tx_provincia" regex="codice2obblchar_regex"> 
        		<missing severity="continue"/>
        		<malformed severity="continue"><rule-action class="com.seda.j2ee5.maf.defender.action.impl.Blank"/></malformed>
        	</rule>
			<rule name="tx_ente" regex="codice10obblchar_regex">
        		<missing severity="continue"/>
        		<malformed severity="continue"><rule-action class="com.seda.j2ee5.maf.defender.action.impl.Blank"/></malformed>
        	</rule>
			
        </ruleset> 			
    </action>
     	
    
    <action url="ritorna.do" flow="true">
		<role-collection>
			<role>AMMI</role>
			<role>AMSO</role>
			<role>AMUT</role>
			<role>AMEN</role>
	    </role-collection>
		<description>Action per la gestione del ritorno ad altro screen con viewstate</description>
        <action-class>org.seda.payer.manager.modello3config.actions.RitornaAction</action-class>
        <flow class="org.seda.payer.manager.modello3config.flows.RitornaFlowAction">
	        <result value="modello3" screen="modello3.do" /> 
        </flow>
    </action> 
    
</actions-mapping>   